url,name,description,price_vnd,image_urls
https://nongnghieppho.vn/products/dat-trong-hoa-hong-sfarm,"Đất trồng hoa hồng Sfarm (20dm³) - Đất sạch trồng hoa hồng, dinh dưỡng hữu cơ, tơi xốp, không cần trộn thêm","Đất trồng hoa hồng Sfarm (20dm³) - Đất sạch trồng hoa hồng, dinh dưỡng hữu cơ, tơi xốp, không cần trộn thêmMô tả sản phẩm đất trồng hoa hồng Bạn có đam mê trồng hoa hồng, nhưng không biết loại đất nào thích hợp để trồng hoa hồng? Bạn đang tìm kiếm sản phẩm đất trông cây hoa hồng chất lượng, nhưng không biết mua đất trồng hoa hông ở đâu? Nếu bạn có những câu hỏi này, thì đất trồng hoa hồng SFarm là sản phẩm dành cho bạn.Đất trồng hoa hồng Sfarm là hỗn hợp giá thể được phối trộn từ các nguồn nguyên liệu cao cấp và nhập khẩu, kết hợp với công nghệ ủ vi sinh đặc biệt để cho ra sản phẩm giá thể giàu vi sinh, hạn chế tối đa mầm bệnh, với công thức phối trộn đặc biệt dành riêng cho hoa hồng. Hình ảnh thực tế về chất đất trồng hoa hồng SfarmXuất xứSản phẩm của Công ty TNHH SX TM DV Đặng Gia Trang, Việt Nam.Công ty Đặng Gia Trang là một công ty chuyên sản xuất và cung cấp các sản phẩm phân bón hữu cơ, giá thể, đất sạch hữu cơ, giá thể trồng hoa hồng, chế phẩm sinh học,… nhằm đáp ứng nhu cầu nông nghiệp sạch, bền vững tại thành thị cũng như nông nghiệp hữu cơ. Quy cách đất trồng hoa hồngTúi 20 dm3, khoảng 7kg, giúp bạn dễ dàng vận chuyển và bảo quản.Ưu điểm của đất sạch trồng hoa hồng Sfarm• Hoa lên chuẩn form và màu sắc đẹp.• Không cần phối trộn vì sản phẩm là đất trồng hoa hồng trộn sẵn và tiện lợi khi dùng.• Nguồn dinh dưỡng đa dạng, đầy đủ và hoàn toàn hữu cơ.• Hoạt chất Azadirachtin trong bột neem giúp hạn chế tối đa các loại sâu bệnh gây hại.• Hệ VSV bản địa dồi dào giúp ngăn ngừa nấm bệnh, phân giải các chất giúp cây dễ hấp thu dinh dưỡng.• Giá thể tơi xốp, thoáng khí, giữ ẩm và thoát nước tốt.• Không mùi, tiện lợi, an toàn cho sức khỏe, dễ dàng bảo quản và sử dụng.• Đặc biệt, đây là dòng giá thể không bị chai cứng hay nén rễ qua thời gian trồng, nên khi sử dụng không cần thay hoàn toàn đất mới mà chỉ cần bổ sung thêm giá thể bị hụt theo thời gian.Thành phần đất trồng bông hồngĐất trồng bông hồng Sfarm là hỗn hợp giá thể được phối trộn từ các nguồn nguyên liệu cao cấp và nhập khẩu gồm phân trùn quế, đá perlite, đá pumice, rêu sphagnum, mụn xơ dừa, đất thịt, bột neem, vi sinh vật,...Với tỷ lệ trộn đất trồng hoa hồng được nghiên cứu kỹ lưỡng. • Phân trùn quế: thành phần dinh dưỡng đa dạng, cung cấp các dưỡng chất thiết yếu cho nhu cầu sử dụng của cây trồng, tăng khả năng ổn định, và phát triển bộ rễ; là nguồn phân bón sạch, không gây mùi khi sử dụng, an toàn cho sức khỏe người sử dụng, thân thiện với môi trường.• Đá perlite: không chứa mầm bệnh & tác nhân gây hại cho cây trồng, hỗ trợ giữ nước và dinh dưỡng cho cây.• Đá pumice: Đá Pumice có công dụng tương tự như đá Perlite nhưng có khối lượng nặng hơn giúp cân bằng, ổn định trọng tâm giúp cây đứng vững, tránh đổ ngã.• Peatmoss - Rêu sphagnum: hay còn được gọi là rêu than bùn có khả năng hút và giữ nước rất tốt, duy trì độ ẩm cho cây, là loại giá thể hoàn toàn vô trùng, không chứa mầm bệnh gây hại.• Mụn xơ dừa: giữ ẩm cho cây.• Đất thịt: có khả năng giữ nước tốt, giúp cây trồng duy trì độ ẩm cần thiết.• Bột Neem: chứa một số hoạt chất kháng nấm bệnh và hạn chế côn trùng gây hại; cung cấp một số khoáng chất và dinh dưỡng hữu cơ cung cấp cho cây trồng.• Vi sinh vật: bảo vệ bộ rễ cây trước nấm bệnh nhờ các vi sinh vật bản địa theo cơ chế đối kháng, các vi sinh vật bản địa rất khỏe và có hoạt tính sinh học cao; phân giải các chất dinh dưỡng về dạng dễ hấp thu cho cây trồng, tăng khả năng hấp thu dinh dưỡng cho cây.Công dụng đất trồng cây hoa hồng SfarmĐất trồng hoa hồng Sfarm là hỗn hợp giá thể được phối trộn sẵn theo công thức chuyên biệt dành cho hoa hồng. Với nguyên liệu đầu vào cao cấp và nhập khẩu, cũng như trải qua quá trình ủ vi sinh đặc biệt, đây sẽ là chất trồng lý tưởng cho hoa hồng với nhiều ưu điểm và công dụng:• Mang đến cho hoa hồng một loại giá thể nhẹ, đặc biệt tơi xốp, thoáng khí, thoát nước tốt nhưng vẫn giữ ẩm tốt.• Chứa hệ vi sinh vật đa dạng giúp hấp thu dinh dưỡng hiệu quả và ngăn ngừa các loại nấm bệnh trên hồng.• Bổ sung hoạt chất Azadirachtin từ bột neem, hiệu quả trong việc ngăn ngừa các loại sâu bệnh gây hại trên hoa hồng.• Nguồn dinh dưỡng đa dạng, đầy đủ và thiết kế chuyên biệt cho nhu cầu dinh dưỡng cao của hoa hồng.• Được bổ sung các chất Humic, Fulvic, IAA... có trong phân trùn quế sẽ giúp nuôi rễ khỏe, kích chồi mạnh mẽ, hoa đậm màu, lâu tàn và chuẩn form.• Hoàn toàn hữu cơ, nguyên liệu chọn lọc giúp cây hoa hồng có sức khỏe bền bỉ và an toàn.• Giá thể nhẹ, không mùi... mang đến những gì tiện lợi nhất.Đối tượng sử dụng• Đây là dòng đất hữu cơ chuyên dụng cho tất cả các loại hoa hồng như hoa hồng leo, hoa hồng ngoại, hoa hồng Ramblers,...• Ngoài ra, còn sử dụng cho một số loại hoa thân bụi như: cát tường, diễm châu, thanh tú, dừa cạn, dạ yến thảo,...Hướng dẫn sử dụng đất sạch trồng hoa hồng• Trồng mới: Cho đất trồng hoa hồng Sfarm vào 2/3 chậu, sau đó đặt cây vào chậu ngay ngắn và tiếp tục cho giá thể vào đầy chậu, dùng tay ấn nhẹ để cây đứng vững và tưới nước giữ ẩm.• Thay đất trồng cũ: Loại bỏ một phần đất cũ, cố gắng tránh làm động rễ, tỉa bỏ các rễ già. Cho giá thể mới vào 1/3 - 1/2 chậu, đặt cây vào rồi tiếp tục cho giá thể vào đầy chậu, dùng tay ấn nhẹ để cây đứng vững và tưới nước giữ ẩm.• Bổ sung giá thể: Đối với các chậu trồng thời gian dài bị hụt lớp mặt giá thể, bổ sung trực tiếp phần giá thể mới đến khi đầy chậu.Hướng dẫn bảo quản• Bảo quản nơi khô ráo, thoáng mát và an toàn.• Tránh xa tầm tay trẻ em.Mua đất trồng hoa hồng ở đâu?Để mua sỉ đất trồng hoa hồng Sfarm chất lượng và uy tín, bạn nên tham khảo Nông Nghiệp Phố, một cửa hàng chuyên cung cấp vật tư nông nghiệp. Tại đây, bạn có thể tìm thấy nhiều loại đất trồng hoa hồng đảm bảo nguồn gốc, chất lượng cao và giá cả hợp lý. Nông Nghiệp Phố không chỉ cung cấp đất trồng Sfarm mà còn có các sản phẩm phục vụ cho nông nghiệp đô thị khác như phân bón, dụng cụ làm vườn, và giống cây trồng.Ngoài ra, khi mua hàng sỉ tại Nông Nghiệp Phố, bạn sẽ nhận được các ưu đãi đặc biệt, hỗ trợ giao hàng tận nơi và chiết khấu lên đến 15% cho các đơn hàng số lượng lớn. Liên hệ ngay với chúng tôi để được tư vấn miễn phí ngay hôm nay!Chính sách mua sỉ các loại đất trồng, phân bón tại cửa hàng Nông Nghiệp PhốNông Nghiệp Phố - Chuỗi cửa hàng chuyên cung cấp đất sạch và giá thể chất lượng, uy tín, hàng đầu trên cả nước.➤ Website: https://nongnghieppho.vn/➤ Hotline: 0865 399 086","93,000","['https://product.hstatic.net/1000269461/product/dat-trong-hoa-hong-sfarm_59d54f9bc5744759ad7a63013eafc54b_9a2a54b0474745858f22b5043dcece26_grande.jpg', 'https://product.hstatic.net/1000269461/product/dat-trong-hong-1_48e005e0cbbc47a9b5b66951445cbe76_c90e01de24ea400085a65d65777b448b_grande.jpg', 'https://product.hstatic.net/1000269461/product/dat-trong-hong-2_2e7cfd29d9154205aed1d74f9be0570f_e7dffc8ff5434ab981392ba7f8fc7af9_grande.jpg']"
https://nongnghieppho.vn/products/combo-cham-soc-hoa-hong-sau-khi-ra-hoa-tai-ch-tp-hcm,Combo chăm sóc hoa hồng sau khi ra hoa - Tại CH TP. HCM,"COMBO CHĂM SÓC HOA HỒNG SAU KHI RA HOA Mô tả sản phẩmSau một thời gian ra hoa, cây hoa hồng dễ bị","103,000","['https://product.hstatic.net/1000269461/product/combo_phuc_hoi_sau_tet__10__c2d8fc1f18334e3e8530cd080c7f2abe_grande.png', 'https://product.hstatic.net/1000269461/product/23_ccc66b6c54d048ba8c8d54dc6c82b34e_grande.png', 'https://product.hstatic.net/1000269461/product/24_327aaa9f450b48d0b94f5967ceda1db9_grande.png']"
https://nongnghieppho.vn/products/phan-bon-chuyen-dung-cho-hoa-su-va-xuong-rong-hp-06-goi-200-gram,Phân bón chuyên dùng cho hoa sứ và xương rồng HP-06 - Gói 200 gram,"PHÂN BÓN CHUYÊN DÙNG CHO HOA SỨ VÀ XƯƠNG RỒNG HP- 06 Mô tả sản phẩm: Phân bón chuyên dùng cho hoa sứ và xương rồng HP - 06 dùng để dưỡng Hoa Sứ & Xương Rồng, kích thích ra hoa và giúp hoa nở đều, kéo dài tuổi thọ của hoa. Xuất xứ: Công ty TNHH Sản Xuất Phân Bón.Quy cách: gói 200 gram.Thành phần: • Đạm tổng số (Nts): 8% • Lân hữu hiệu (P2O5hh): 8% • K2O:  8% • Hữu cơ: 4,8%• Axit Humic: 1%• Amino Acid; 0,9%• Vi lượng: Fe = 0,5%; Zn = 1%; Cu = 0,5%; Mn = 0,5%Chức năng - công dụng• Các nguyên tố dinh dưỡng bảo đảm sự cân đối cho nhu cầu của Hoa Sứ và Xương Rồng. • Kích thích quá trình ra hoa, tăng màu sắc đậm đà và kéo dài tuổi thọ của hoa. • HP - 06 giúp hoa Sứ và Xương Rồng bền đẹp hơn. • Dạng tan chậm, bổ sung dưỡng chất lên đến 03 tháng. Hướng dẫn sử dụng• Tùy theo kích thước chậu hoa và bồn xi măng bón từ 10-30g/chậu. • HP - 06 là phân tan chậm nên bón định kỳ 3 tháng/lần. Hướng dẫn bảo quản• Để nơi khô ráo thoáng mát, tránh ánh sáng trực tiếp. • Đậy nắp kín sau khi sử dụng.  • Tránh ra tầm tay trẻ em, không được ăn, vệ sinh sạch sẽ sau khi sử dụng. Nông Nghiệp Phố - chuỗi cửa hàng chuyên cung cấp các dòng phân bón chất lượng, uy tín và hàng đầu trên cả nước.➤ Website: https://nongnghieppho.vn/➤ Hotline: 0865 399 086","24,000","['https://product.hstatic.net/1000269461/product/hp-06_e64543170d824e0a9d14aac9cae464af_grande.jpg', 'https://product.hstatic.net/1000269461/product/305_22b869be83f948e8a94374cb2ace615b_grande.png', 'https://product.hstatic.net/1000269461/product/tui_dao_don_-_tui_guc_nga__5__7031ed9ff0584ee0b5bb8501750a66d3_grande.png']"
https://nongnghieppho.vn/products/gia-the-cho-cay-trong-chau-seramis-sfarm-tui-6-lit,Giá thể cho cây trồng chậu SERAMIS - Túi 6 lít,"GIÁ THỂ CHO CÂY TRỒNG CHẬU SERAMIS SFARMMô tả: Giá thể cho cây trồng chậu Seramis được tạo thành từ 100% đất sét tự nhiên của vùng Westerwald (nước Đức), sau đó được nung ở nhiệt độ cao bởi hệ thống dây chuyền sản xuất hiện đại để tạo nên những hạt đất sét màu nâu đỏ đẹp mắt, bên trong chứa cấu trúc nhiều lỗ khí có khả năng giữ nước, giữ dinh dưỡng và lưu thông oxy. Đây là loại giá thể bền bỉ, không bị hao hụt qua thời gian, sẽ là giá thể lý tưởng để bạn thay chậu, phủ mặt, trồng cây thủy sinh cho tất cả các giống cây trồng trong không gian nhà ở.Xuất xứ: Đức. Nhập khẩu bởi: CÔNG TY TNHH SX - TM - DV ĐẶNG GIA TRANGQuy cách: 6 lít. Thành phần • 100% đất sét tự nhiên vùng Westerwald (nước Đức).• Dinh dưỡng khoáng NPK. Ưu điểm của Giá thể cho cây trồng chậu Seramis • Không nén dẻ, không hụt chậu, dễ dàng khi thay chậu.• Hạn chế bốc thoát hơi nước, tiếc kiệm nước tưới và công chăm sóc.• Thông thoáng cho cây, cực kỳ tốt cho rễ phát triển.• Hấp thu nước và dinh dưỡng tối ưu.• Hạn chế sự phá hoại của các loại côn trùng đẻ trứng.• Sạch sẽ, tiện lợi, vệ sinh.Đối tượng cây trồng • Phù hợp cho tất cả các loại cây trồng chậu ngoài trời.Hướng dẫn sử dụng • Trộn giá thể trồng cây: trộn với tỷ lệ khoảng 10% tổng lượng giá thể.• Thay chậu: Cho một lượng đất vào chậu mới có kích thước lớn hơn chậu cũ, sau đó đặt bầu cây vào chậu mới, tiếp tục cho giá thể vào cho đến khi đầy chậu, dùng tay ấn nhẹ để cây đứng vững, tưới nước & giữ ẩm cho cậy.• Rải mặt chậu: rải một lớp khoảng 3cm đều trên bề mặt chậu giúp giữ ẩm chậu cây tốt hơn.Hướng dẫn bảo quản• Seramis được bảo quản nơi khô ráo, thoáng mát và an toàn.• Tránh xa tầm với trẻ em, vệ sinh tay sạch sẽ sau khi sử dụng. Nông Nghiệp Phố - chuỗi cửa hàng chuyên cung cấp đất sạch và giá thể chất lượng, uy tín, hàng đầu trên cả nước.➤ Website: https://nongnghieppho.vn/➤ Hotline: 0865 399 086","281,000","['https://product.hstatic.net/1000269461/product/trong_cay_39973a2202344be48df55d2889081d6a_grande.png', 'https://product.hstatic.net/1000269461/product/8_d711199b6b554ba2ab96f82c43081fdf_grande.png', 'https://product.hstatic.net/1000269461/product/trong_cay__2__38f19338858a4cfd89643560252c0306_grande.png']"
https://nongnghieppho.vn/products/combo-cham-soc-hoa-lan-ra-hoa-tai-ch-tp-hcm,Combo chăm sóc hoa lan ra hoa - Tại CH TP. HCM,"COMBO CHĂM SÓC HOA LAN RA HOA Mô tả sản phẩmCombo chăm sóc lan ra hoa cung cấp nguồn dinh dưỡng đầy đủ, đa dạng, an toàn giúp cây ra rễ mạnh, sinh trưởng và phát triển khỏe, đề kháng tốt, kích thích phân hóa mầm hoa, hoa to đẹp, lâu tàn.Combo bao gồm các sản phẩm• 01 Phân bón lá đậm đặc cao cấp Vitamin B1 Growmore - Chai 100ml. • 01 Chế phẩm kích hoa và dưỡng hoa Powerfeed nhập khẩu từ Úc - Chai 100ml. • 01 Phân tan chậm có kiểm soát Rynan FM 220 ( 12-12-20 ) - Lọ 150 gram. Chức năng - công dụng• Vitamin B1 Growmore: kích thích ra rễ cho lan cứng đầu, ra rễ nhanh với cây trồng mới, lan được sang chậu được chiết, kích lá ra đọt non, kích rễ mầm gốc, kie trên thân phong lan.• Kích hoa và dưỡng hoa Powerfeed: được chiết xuất từ cá hồi, chứa hàm lượng đạm cao, dồi dào vitamin, acid amin và các nguyên tố khoáng có lợi cho cây trồng giúp kích thích hoa phát triển mạnh, hoa bền màu, cánh hoa dày và hoa lâu tàn hơn.• Phân Rynan FM 220 (12-12-20): là dòng phân bón thông minh, có khả năng kiểm soát và điều tiết khả năng nhả của phân nhờ lớp màng polymer bao quanh, giúp đánh bật mầm ngủ của hoa, giúp hoa lâu tàn. Ngoài ra còn giúp giữ màu hoa bền đẹp, hương thơm tự nhiên hơn, giảm khả năng suy cây sau ra hoa.Hướng dẫn sử dụng• Tiến hành sử dụng 5 gram phân Rynan cho vào túi lưới sau đó đặt/gắn lên giò lan hoặc có thể rải phân lên trên bề mặt chậu, xung quanh gốc lan (tùy theo gốc lớn hay nhỏ mà điều chỉnh lượng phân bón). Bón cách gốc ít nhất 5cm và vùi trong đất ít nhất 5cm và lấp đất lại. Tưới nước và chăm sóc bình thường.• Sử dụng kết hợp phân bón lá giúp cây hấp thu dinh dưỡng toàn diện, phát triển đồng đều bằng cách pha 10ml Vitamin B1 + 10ml Powerfeed cho bình 10 lít phun ướt đều thân lá và cả giá thể trồng định kỳ 7 - 10 ngày 1 lần.• Nên phun vào sáng sớm hoặc chiều mát.Hướng dẫn bảo quản• Để xa tầm tay trẻ em, nguồn thực phẩm và nguồn nước.• Bảo quản nơi khô ráo, thoáng mát, tránh ánh nắng trực tiếp.• Đậy nắp kĩ sau khi sử dụng.Nông Nghiệp Phố - chuỗi cửa hàng chuyên cung cấp vật tư trồng lan chất lượng, uy tín với hơn 1000+ sản phẩm chậu trồng lan, phân bón cho lan, giá thể trồng lan....➤ Website: https://nongnghieppho.vn/➤ Hotline: 0865 399 086","69,000","['https://product.hstatic.net/1000269461/product/combo_phuc_hoi_sau_tet__7__e6d8a43a531d4906926717ec6d294bdc_grande.png', 'https://product.hstatic.net/1000269461/product/18_de99085a5363464eab14b66d93c8b216_grande.png', 'https://product.hstatic.net/1000269461/product/19_521126f775c64929b6fba56569607720_grande.png']"
https://nongnghieppho.vn/products/hat-giong-cai-cu-do-tron-pn-0636-goi-1-gram,Hạt giống Cải củ đỏ tròn PN 0636 - Gói 1 gram,"Hạt Giống Củ Cải Đỏ Tròn PN 0636 – Gói 1gram Hạt Giống Củ Cải Đỏ Tròn PN 0636 - Gói 1g là giống củ cải dễ trồng, sinh trưởng mạnh, cho củ tròn đều, vỏ đỏ đẹp, ruột trắng giòn và vị ngọt thanh. Thời gian thu hoạch nhanh chỉ 30 - 35 ngày, phù hợp trồng tại nhà, vườn rau sạch hoặc canh tác nông trại. Hạt giống chất lượng cao, tỷ lệ nảy mầm tốt, giúp bạn dễ dàng có được vụ mùa bội thu.Xuất xứ:Hạt giống Phú Nông Seeds – một thương hiệu uy tín với chất lượng hạt giống vượt trội.Xuất xứ: Trung QuốcQuy cách:Trọng lượng gói: 1gĐộ sạch (P): ≥ 98%Độ ẩm (G): ≤ 9%Tỷ lệ nảy mầm: ≥ 80%Thành phần:100% hạt giống củ cải đỏ tròn F1 chất lượng cao, không pha trộn tạp chất.Đối tượng cây trồng:Phù hợp với trồng rau sạch tại nhà, sân vườn, nông trại.Trồng được trong chậu, thùng xốp, luống đất.Công dụng:Sinh trưởng mạnh, dễ trồng, kháng bệnh tốt.Củ tròn đều, đường kính 3 - 4cm, màu đỏ tươi đẹp mắt.Ruột trắng, củ chắc, trọng lượng 50 - 80g vị ngọt thanh, giòn – thích hợp dùng trong salad, món ăn healthy.Thu hoạch sớm chỉ 30 - 35 ngày sau gieo.Hướng dẫn sử dụng:Chuẩn bị đất: Đất tơi xốp, giàu dinh dưỡng, thoát nước tốt.Ngâm hạt: Ngâm nước ấm (2 sôi : 3 lạnh) khoảng 2 - 3 giờ, sau đó vớt ra để ráo.Gieo hạt: Gieo trực tiếp xuống đất theo khoảng cách 10 x 15 cm.Mật độ: 8 - 10 kg/ha.Tưới nước: Giữ ẩm đất, tưới nhẹ mỗi ngày.Hướng dẫn bảo quản:Bảo quản hạt giống nơi khô ráo, thoáng mát.Tránh ánh nắng trực tiếp và ẩm mốc.Đậy kín sau khi mở bao bì để đảm bảo chất lượng hạt giống.THÔNG TIN LIÊN HỆWebsite: https://nongnghieppho.vn/Hotline: 086 5399 086Zalo: https://zalo.me/","12,000",['https://product.hstatic.net/1000269461/product/hat-giong_b0c60b5d5eb44cd08879dfd2ba07bbf3_grande.jpg']
https://nongnghieppho.vn/products/hat-giong-kinh-gioi-rado-11-goi-1-gram,Hạt giống Kinh giới RADO 11 - Gói 1 gram,"HẠT GIỐNG KINH GIỚI RADO 11 Mô tả sản phẩmHạt giống Kinh giới Rado 11 là giống rau phát triển mạnh, kháng bệnh tốt, thích nghi rộng. Rau kinh giới có dạng cây thân bụi, lá trung bình, màu xanh nhạt, rìa lá răng cưa, thơm ngon. Xuất xứ: CÔNG TY TNHH MTV HẠT GIỐNG RẠNG ĐÔNGQuy cách đóng gói: Gói 1 gram.Một số thông tin • Tỷ lệ nảy mầm: >85%.• Ðộ sạch: >99%.• Độ ẩm: <10%.Hướng dẫn cách trồng • Thời gian thu hoạch: 35-40 ngày sau gieo, cắt cành nhiều lần hoặc ngắt đọt. • Khoảng cách trồng: 20x20cm, lượng giống/1000m2: 15-20 gram. 1/ Đất trồng: • Đất phải đủ dinh dưỡng, có độ PH phù hợp và độ thoát nước tốt. Tỷ lệ trọn thông thường: đất thịt 50% : phân hữu cơ 20% (trùn quế, phân bò, phân gà,...) : mụn dừa : trấu hun. Hoặc sử dụng đất trồng rau Sfarm. • Sử dụng thêm nấm đối kháng Trichoderma để bổ sung vi sinh có lợi cho đất. 2/ Ánh sáng: trồng nơi có ánh sáng đầy đủ. 3/ Chăm sóc: • Tưới nước: tùy vào thời tiết mà tưới nước cho phù hợp, tránh tưới và bạn đêm dễ gây nấm bệnh cho cây, trời nắng bạn tưới 2 ngày/lần, nếu đất ẩm thì 1 lần/ngày. • Phân bón: sau 10 ngày chuyển chậu, bạn bắt đầu thêm phân bón hữu cơ cho cây, mỗi 10 ngày bổ sung thêm cho cây.• Phòng trừ sâu bệnh: bằng cách sử dụng thuốc BVTV. 4/ Thu hoạch • Sau khoảng 40 ngày trồng, bạn có thể cắt cành kinh giới và chưa lại các nách lá có chồi non để cây tiếp tục phát triển. Hướng dẫn bảo quản• Bảo quản hạt giống nơi khô ráo, không để trực tiếp dưới ánh nắng hoặc nơi có nhiệt độ cao.• Chất lượng hạt giống tốt nhất khi bao bì còn nguyên vẹn.Nông Nghiệp Phố - chuỗi cửa hàng chuyên cung cấp hạt giống uy tín với hơn 1000+ loại giống.➤ Website: https://nongnghieppho.vn/➤ Hotline: 0865 399 086","12,000","['https://product.hstatic.net/1000269461/product/304_2b6cf1c5a68f44b3912ed12b1fb3ffbc_grande.png', 'https://product.hstatic.net/1000269461/product/tui_dao_don_-_tui_guc_nga__2__b1d9e262b9fb4e359509b17b67319132_grande.png', 'https://product.hstatic.net/1000269461/product/tui_dao_don_-_tui_guc_nga__1__7762add0eff44860a5b74ff3c506f309_grande.png']"
https://nongnghieppho.vn/products/thuoc-tru-oc-dang-phun-helix-500wp-chai-50-gram,Thuốc trừ ốc dạng phun HELIX 500WP - Chai 50 gram,"THUỐC TRỪ ỐC DẠNG PHUN HELIX 500WP Mô tả sản phẩm: Thuốc trừ ốc dạng phun Helix 500wp chuyên đặc trị ốc hiệu quả cao. Đặc biệt Helix 500wp chuyên trị ốc gây hại trên cây cảnh, lúa. Xuất xứ: Công ty TNHH TM Tân Thành.Quy cách: chai 50g.Thành phần• Metaldehyde...500g/kg.• Phụ gia đặc biệt vừa đủ 1kg. Công dụngThuốc trừ sâu bệnh, đặc trị ốc sên, ốc bươu vàng, có tác động lên hệ thống hô hấp, hệ tiêu hóa của ốc. + Ốc chảy nhớt không ăn, không di chuyển được. + Ốc chết nhanh sau khi tiếp xúc với thuốc. Hướng dẫn sử dụng• Đối với cây cảnh, rau màu, cây ăn quả: + Ốc sên: - Pha 50g/bình 16 lít, lượng nước phun 320 lít/ha. - Lượng nước phun 320 lít/ha. - Phun lúc trời mát, theo đường di chuyển của ốc. • Đối với lúa+ Ốc bươu vàng: - Liều lượng: 1-1.2kg/ ha. - Lượng nước phun 320 lít/ha. - Phun thuốc khi ruộng có nước 1-5cm. • Thời gian cách ly: không xác định. Cảnh báo an toàn• Không để thuốc dính vào mắt, da, không ăn uống, hút thuốc khi phun thuốc.• Tránh làm rơi vào nguồn nước và ao hồ thủy sản.• Nếu nuốt phải thuốc phải nhanh chóng đến cơ sở y tế gần nhất và cầm theo nhãn thuốc.Hướng dẫn bảo quản• Bảo quản nơi khô ráo, thoáng mát và tránh ánh nắng trực tiếp mặt trời.• Để xa tầm tay trẻ em, nguồn thực phẩm, nguồn nước.Nông Nghiệp Phố - chuỗi cửa hàng chuyên cung cấp chế phẩm phòng trừ sâu bệnh chất lượng, uy tín và hàng đầu trên cả nước.➤ Website: https://nongnghieppho.vn/➤ Hotline: 0865 399 086","23,000","['https://product.hstatic.net/1000269461/product/helix_500wp_e72c6a4e680f4c8daacc5cf03501c3b2_grande.jpg', 'https://product.hstatic.net/1000269461/product/219_94f1fb801af64bb38b613a1eeefcfdae_grande.png', 'https://product.hstatic.net/1000269461/product/218_81e654a1b04c45f2a285cb7499c54759_grande.png']"
