url,name,description,price_vnd,image_urls
https://nongnghieppho.vn/products/hat-giong-bi-soi-mi-squash-spaghetti-223-goi-10-hat,Hạt giống Bí sợi mì SQUASH SPAGHETTI 223 Rạng Đông - Gói 10 hạt,"HẠT GIỐNG BÍ SỢI MÌ SQUASH SPAGHETTI 223 Mô tả sản phẩmHạt giống Bí sợi mì Squash Spaghetti 223 là giống bí có quả màu vàng nhạt, hình bầu dục, thuôn dài, mỗi trái nặng 1,5 - 2kg. Vỏ cứng và có thể bảo quản được rất lâu. Cây sinh trưởng, phát triển mạnh, trồng được quanh năm. Thu hoạch sau 75-85 ngày gieo.Bí sợi mì là một chất thay thế cho mì ống tuyệt vời. Khi dùng nĩa tách ra, phần thịt bí spaghetti nấu chín có dạng như sợi mì. Hương vị nhẹ tuyệt vời khi phủ một lớp sốt. Xuất xứ: CÔNG TY TNHH MTV HẠT GIỐNG RẠNG ĐÔNGQuy cách đóng gói: Gói 10 hạtMột số thông tin • Tỷ lệ nảy mầm: >85%.• Ðộ sạch: >99%.• Độ ẩm: <10%.• Xuất xứ: Italy Hướng dẫn cách ươm hạt và chăm sóc 1/ Ươm và gieo hạt • Ngâm hạt giống bí sợi mì trong nước ấm 45 độ C từ 5–8 tiếng rồi vớt ra và ủ trong khăn ẩm ở nhiệt độ 27 – 30 độ C. • Khoảng 40 – 42 giờ hạt sẽ nứt nanh thì đem gieo vào khay/bầu ươm, 2 hạt/lỗ. • Sau gieo tưới phun sương nhẹ làm ẩm đất: khi trời nắng nóng, độ ẩm xuống thấp thì tưới 2 lần/ngày vào sáng sớm và chiều mát; khi trời mát tưới 1 lần/ngày. • Nếu cây non trong bầu ươm phát triển kém thì bón thúc khoảng 0,1% đạm pha với nước sạch, chỉ bón tối đa 2 lần khi cây con có 2 – 3 lá thật và sau 7 – 10 ngày từ khi gieo hạt. 2/ Trồng cây con • Khi cây bí sợi mì non có 4 – 5 lá thật thì bứng đem trồng ra đồng ruộng hoặc các chậu/thùng xốp cỡ lớn. • Chọn cây khỏe, lá xanh to để trồng. Trồng nhẹ nhàng tránh làm gãy, hỏng cây. • Sau khi trồng tưới đẫm nước cho chặt gốc, đồng thời đặt đất cục xung quanh gốc giúp cây không bị đổ. 3/ Chăm sóc • Tưới nước: - Ngày nắng nóng tưới 2 lần/ngày, khi trời mát tưới 1 lần/ngày.- Bí sợi mì chịu hạn tốt hơn ngập úng nên cần chú ý thoát nước cho cây vào mùa mưa, tránh làm cây và quả bị thối. Đồng thời nhặt sạch cỏ, lá già để tạo độ thông thoáng cho đất trồng bí đỏ. • Bấm ngọn, sửa dây, tạo hình- Bấm ngọn khi cây ra được 4 – 5 lá thật để tạo nhánh, hạn chế thân chính phát triển quá dài.- Khi bí ra dây dài khoảng 1m thì dùng đất đắp một đoạn thân xuống nhằm kích thích rễ phụ phát triển, giúp cây hút được nhiều chất dinh dưỡng hơn. - Mỗi dây bí sợi mì chỉ nên để từ 2 - 4 nhánh hoặc 1 dây chính và 2 dây nhánh. • Thụ phấn bổ sung: - Sau khoảng 40 – 45 ngày, bí  bắt đầu ra hoa, thông thường tỷ lệ hoa đực nhiều gấp 20 lần hoa cái, hoa thụ phấn nhờ gió và ong bướm. - Người trồng hãy thụ phấn bổ sung cho hoa bằng cách chạm nhị hoa đực vào núm nhụy hoa cái. • Lưu ý: tiến hành thụ phấn bổ sung vào thời tiết khô ráo, thoáng mát. Hướng dẫn bảo quản• Bảo quản hạt giống nơi khô ráo, không để trực tiếp dưới ánh nắng hoặc nơi có nhiệt độ cao.• Chất lượng hạt giống tốt nhất khi bao bì còn nguyên vẹn.Nông Nghiệp Phố - chuỗi cửa hàng chuyên cung cấp hạt giống uy tín với hơn 1000+ loại giống.➤ Website: https://nongnghieppho.vn/➤ Hotline: 0865 399 086","25,000","['https://product.hstatic.net/1000269461/product/222_148ab87a8ae345bba1b089d88abf7c04_grande.png', 'https://product.hstatic.net/1000269461/product/226_6c1c636647a54f04b4995006afe338ea_grande.png', 'https://product.hstatic.net/1000269461/product/224_2b0c3f4252d043a7b0cec4070bbcf8cd_grande.png']"
https://nongnghieppho.vn/products/hat-giong-rau-muong-liao-9-east-west-seed-hai-mui-ten-do-goi-500-hat,Hạt giống Rau muống Liao 9 East-West Seed (Hai Mũi Tên Đỏ) - Gói 100gr,"HẠT GIỐNG RAU MUỐNG LIAO 9Mô tả: Hạt giống rau muống Liao 9 là giống rau muống sinh trưởng nhanh. Thân thẳng, lóng ở gốc dài nên đỡ tốn công lao động hái bỏ lá gốc khi thu hoạch, mẫu mã đẹp. Hình dạng lá tre nhỏ. Chất lượng ăn giòn, ngon. Xuất xứ: CÔNG TY TNHH EAST- WEST SEED (HAI MŨI TÊN ĐỎ)Quy cách đóng gói: Gói 100gr. Một số thông tin• Độ sạch (P): ≥ 99%• Tỷ lệ nảy mầm (G): ≥ 80%• Độ ẩm (H): ≤ 11% Đặc tính giống • Cây sinh trưởng nhanh. • Thân thẳng, lóng ở gốc dài nên đỡ tốn công lao động hái bỏ gốc sau khi thu hoạch, mẫu mã đẹp. • Hình dạng lá tre nhỏ. • Chất lượng ăn giòn, ngon. Hướng dẫn sử dụng• Thu hoạch sau gieo 20 - 24 ngày. • Trồng được quanh năm. Lượng giống sử dụng 10 - 12kg/1000m2. • Khuyến cáo nên ngâm hạt trong nước ấm (pha 2 sôi 3 lạnh) từ 2 - 3 giờ trước khi gieo. Hướng dẫn bảo quản• Bảo quản hạt giống nơi khô ráo, không để trực tiếp dưới ánh nắng hoặc nơi có nhiệt độ cao.• Chất lượng hạt giống tốt nhất khi bao bì còn nguyên vẹn.Nông Nghiệp Phố - chuỗi cửa hàng chuyên cung cấp hạt giống uy tín với hơn 1000+ loại giống.➤ Website: https://nongnghieppho.vn/➤ Hotline: 0865 399 086","19,000","['https://product.hstatic.net/1000269461/product/hat-rau-muong-liao9_1d3e1d1da4364982b18da43b19515175_grande.jpg', 'https://product.hstatic.net/1000269461/product/thiet_ke_chua_co_ten__22__d903cc55e4cf4202831c30d24e4c6d2c_grande.png']"
https://nongnghieppho.vn/products/chat-gay-rung-la-mai-dai-hoc-can-tho-goi-180-gram,Chất gây rụng lá mai Đại Học Cần Thơ - Gói 180 gram,"CHẤT GÂY RỤNG LÁ MAI ĐẠI HỌC CẦN THƠMô tả sản phẩm:Chất gây rụng lá mai vàng của Đại Học Cần Thơ là dòng thuốc chuyên dùng để giúp cây mai vàng, mai chiếu thủy rụng lá đồng loạt sau 2-3 ngày phun. Giúp chúng ta căn được chính xác thời điểm vặt lá để hoa ra đúng dịp Tết, tránh tình trạng vặt lá không kịp nên hoa nở sớm hoặc trễ hơn dự kiến. Ngoài rụng lá, sản phẩm còn giúp nụ to đẹp và hoa nở đồng loạt. Xuất xứ: CÔNG TY TNHH HÓA NÔNG VIỆT THÁI Quy cách: gói 180 gram.Thành phần:• Bo: 2000ppm. • Phụ gia đặc biệt.Công dụng của sản phẩm:• Thuốc có chứa chất gây rụng lá mai vàng, mai chiếu thủy đồng loạt sau 2-3 ngày phun. • Kích thích to nụ hoa. • Giúp hoa nở đồng loạt. Hướng dẫn cách sử dụng chất gây rụng lá mai ĐHCT: • Pha tỉ lệ 18gr/1 lít nước sạch. • Phun ướt đều lên lá mai. • Sau 2-3 ngày cây sẽ rụng lá, không ảnh hưởng tới nụ. • Thời gian phun cho hoa mai vàng thường 12-20 tháng 12 âm lịch (tùy vào tình trạng của cây để vặt đúng thời điểm). Lưu ý• Rửa sạch tay chân sau khi sử dụng. • Để xa nguồn nước, thực phẩm và trẻ em. • Bảo quản nơi khô ráo, thoáng mát. Nông Nghiệp Phố - chuỗi cửa hàng chuyên cung cấp phân bón chất lượng, uy tín và hàng đầu trên cả nước.➤ Website: https://nongnghieppho.vn/➤ Hotline: 0865 399 086","53,000","['https://product.hstatic.net/1000269461/product/51_093f1c71c4f24cf1b2704faa429529d2_grande.png', 'https://product.hstatic.net/1000269461/product/52_1974bf3f71114cacbcbec5d32447579f_grande.png']"
https://nongnghieppho.vn/products/thuoc-tru-sau-pro-ggo-440ec-chai-450ml,Thuốc trừ sâu PRO GGO 440EC - Chai 100ml,"THUỐC TRỪ SÂU PRO GGO 440EC Mô tả sản phẩm: Thuốc trừ sâu PRO GGO 440EC có tác dụng nội hấp, tiếp xúc và vị độc, mang lại hiệu lực trừ sâu, nhện nhanh và kéo dài. Thuốc trừ sâu bệnh PRO GGO 440EC là sự kết hợp hoàn hảo đặc biệt của hai hoạt chất Profenofos và Cypermethrin, giúp hỗ trợ quá trình trừ sâu bệnh nhanh chóng và hiệu quả.Xuất xứ: Anhiu Richen Plant Protection Engineering Co., Ltd. Đơn vị phân phối: CÔNG TY TNHH VIỆT THẮNG Quy cách: Chai 100mlThành phần• Profenofos 400g/l • Cypermethrin 40g/l Công dụng• Hoạt chất Profenofos + Cypermethrin được nhiều công ty đăng ký để đặc trị rệp sáp, rệp muội, sâu vẽ bùa, sâu đục thân, sâu cuốn lá, bọ trĩ, nhện, sâu xanh da láng trên: cây ăn quả, lúa, hoa cây cảnh, rau màu,…• Pro ggo 440EC đăng ký để trừ sâu xanh da láng trên lạc. Hướng dẫn sử dụng• Lượng thuốc: 0.8 lít/ha• Lượng nước: 500 - 600 lít/ha• Cách pha phun: Pha 25-30ml cho bình 16-20 lít nước. Phun khi sâu non tuổi 1-2 mới xuất hiện gây hại, mật độ khoảng 1-2 con trên cây, phun ướt đều tán lá cả 2 mặt bên trên và dưới. • Thời gian cách ly: 7 ngày trước khi thu hoạch Hướng dẫn bảo quản• Bảo quản nơi khô ráo, thoáng mát và tránh ánh nắng trực tiếp mặt trời.• Để xa tầm tay trẻ em, nguồn thực phẩm, nguồn nước.Nông Nghiệp Phố - chuỗi cửa hàng chuyên cung cấp chế phẩm phòng trừ sâu bệnh chất lượng, uy tín và hàng đầu trên cả nước.➤ Website: https://nongnghieppho.vn/➤ Hotline: 0865 399 086","48,000","['https://product.hstatic.net/1000269461/product/pro-ggo-440ec_3a48c7e90f4148a38a18327ff932d901_grande.jpg', 'https://product.hstatic.net/1000269461/product/186_73e8540922bb441ba49c6fcd5d6c17bc_grande.png', 'https://product.hstatic.net/1000269461/product/187_d67f24108332413b83d64e853ed3c7ce_grande.png']"
https://nongnghieppho.vn/products/chau-luc-giac-gia-gach-trong-cay-kieng1,"Chậu nhựa trồng cây lục giác – Chất liệu nhựa bền chắc, có lỗ thoát nước, trồng kiểng, bonsai","Chậu nhựa trồng cây lục giác – Chất liệu nhựa bền chắc, có lỗ thoát nước, trồng kiểng, bonsaiMô tả sản phẩmChậu nhựa lục giác giả gạch được thiết kế kiểu 06 cạnh đều, sản phẩm sản xuất từ nhựa PP cao cấp rất bền, chịu nhiệt tốt. Chậu lục giác được thiết kế bề ngoài tựa như những viên gạch xếp trồng lên nhau rất đẹp mắt, mang lại nét cổ xưa và dung dị. Chậu nhựa dạng lục giác có nhiều kích thước, thích hợp trồng nhiều loại cây nội thất, cây cảnh lâu năm, cây bon sai hay các cây cảnh to như hồng, mai, đào...Xuất xứChậu kiểng lục giác được sản xuất tại Việt Nam, chất lượng cao.Chất liệuChậu lục giác giả gạch được sản xuất từ nhựa PP nguyên chất cao cấp, dày, dẻo, độ bền cao.Màu sắcChậu lục giác đẹp với màu nâu đỏ tươi tắn, gợi nhớ sắc gạch nung truyền thống, mang lại cảm giác gần gũi và ấm áp cho không gian trồng cây.Kích thước chậu lục giác• Chậu nhựa lục giác 380: 28x20 cm (Đường kính x Chiều cao).• Chậu nhựa lục giác cỡ lớn 480: 36x25 cm (Đường kính x Chiều cao).Ưu điểm nổi trội của chậu nhựa lục giác• Chất liệu nhựa PP cao cấp, không độc hại, không bị lão hóa, rất bền đẹp, đáy có 3 lỗ thoát nước.• Gia công tốt, bề mặt và các góc cạnh của chậu đều được làm rất tỉ mỉ, mặt chậu được tráng bóng, màu sắc gạch tươi tắn, chân thật và rất dễ lau chùi.• Chậu làm bằng nhựa nên rất nhẹ, dễ dàng di chuyển và khuân vác so với các loại chậu sành sứ hay xi măng cùng kích thước.Chức năng - Công dụng của chậu lục giác• Chậu cảnh lục giác được dùng trồng các loại cây kiểng văn phòng.• Trồng các loại cây nội thất.•  Trồng các loại cây cảnh lâu năm, cây bon sai hay các cây cảnh to như hồng, mai, đào...Nông Nghiệp Phố - Chuỗi cửa hàng chuyên cung cấp chậu và khay trồng chất lượng, uy tín với hơn 1000+ loại chậu, khay trồng với nhiều mẫu mã, kích thước và màu sắc.➤ Website: https://nongnghieppho.vn/➤ Hotline: 0865 399 086","21,000","['https://product.hstatic.net/1000269461/product/chau_lg_0504ab2e51244e03bcdcea33007d5c61_cefb97c38904442a8133f78d9d8d5889_grande.jpg', 'https://product.hstatic.net/1000269461/product/chau_lg_1_6511952b95c2468082d0783e4107fceb_6c5dfab835ec4939948b56ac00909e9d_grande.jpg', 'https://product.hstatic.net/1000269461/product/chau_lg_2_a0de58257a8048469c038c7c5c221ced_43b5d4fd410c4c93819838e9f43259dc_grande.jpg']"
https://nongnghieppho.vn/products/hat-giong,Hạt giống Cải ngọt cao sản Champion East-West Seed (Hai Mũi Tên Đỏ) - Gói 100gr,"HẠT GIỐNG CẢI NGỌT CHAMPION Mô tả: Hạt giống cải ngọt Champion là giống cải ngọt có thân cây gọn, chống đổ ngã, trồng được quanh năm. Xuất xứ: CÔNG TY TNHH EAST- WEST SEED (HAI MŨI TÊN ĐỎ)Quy cách đóng gói: Gói 100 gram. Một số thông tin• Độ sạch (P): ≥ 99%• Tỷ lệ nảy mầm (G): ≥ 80%• Độ ẩm (H): ≤ 7% Đặc tính giống • Thân cây gọn, chống đổ ngã, trồng được quanh năm.Hướng dẫn sử dụng• Khoảng cách trồng: (15cm - 20cm) x 15cm. • Sử dụng 200 -  300 gram hạt/1000m2. Hướng dẫn bảo quản• Bảo quản hạt giống nơi khô ráo, không để trực tiếp dưới ánh nắng hoặc nơi có nhiệt độ cao.• Chất lượng hạt giống tốt nhất khi bao bì còn nguyên vẹn.Nông Nghiệp Phố - chuỗi cửa hàng chuyên cung cấp hạt giống uy tín với hơn 1000+ loại giống.➤ Website: https://nongnghieppho.vn/➤ Hotline: 0865 399 086","29,000",['https://product.hstatic.net/1000269461/product/thiet_ke_chua_co_ten__24__1dedf33d8266494f94d623df4ee4b132_grande.png']
https://nongnghieppho.vn/products/phan-npk-phu-my-20-5-5-te-cay-an-qua-goi-500gram,Phân NPK Phú Mỹ 20-5-5 + TE Cây ăn quả - Gói 500 gram,"Phân NPK Phú Mỹ 20-5-5 + TE Cây ăn quả Mô tả sản phẩmPhân NPK Phú Mỹ 20-5-5 + TE cây ăn quả chuyên dùng cam, chanh, bưởi, xoài, nhãn, sầu riêng, chôm chôm, ổi, na,... với hàm lượng đạm cao giúp cây siêu bung đọt, vươn mầm, thân lá cành phát triển nhanh.Xuất xứPhân NPK Phú Mỹ 20-5-5 + TE cây ăn quả là sản phẩm của Tổng Công ty Phân bón và Hóa chất Dầu khí (PVFCCo).Quy cáchGói 500gram nhỏ gọn, dễ dang sử dụng và bảo quản, chuyên dùng cho nông nghiệp đô thị.Thành phần• Đạm tổng số (Nts): 20%• Lân hữu hiệu (P2O5hh): 5%• Kali hữu hiệu (K2Ohh): 5%• Độ ẩm: 5%Vi lượng (TE):• Kẽm (Zn): 50ppm• Bo (B): 50ppmƯu điểm vượt trội• Cung cấp đầy đủ dinh dưỡng cho cây trồng giai đoạn cây con, sau khi cắt cành hoặc thu hoạch.• Thúc đâm chồi, ra lá, cây phát triển nhanh.• Phục hồi nhanh sau khi thu hoạch.• Bổ sung vi lượng TE giúp nâng cao chất lượng nông sản.Hướng dẫn sử dụngLiều lượng phân bón• Bón 100gram - 300gram/ cây/ lần (tùy độ tuổi cây, cây nhỏ bón lượng ít).• Tùy theo tán cây lớn hay nhỏ mà lượng bón nhiều hay ít, trung bình cứ 1m đường kính tán sẽ bón từ 200gram - 300gram.Lưu ý• Sử dụng bón lần 1 hoặc bón sau khi cắt tỉa hay bón phục hồi sau thu hoạch.• Bón lần 1 sau khi trồng từ 5 - 7 ngày.• Lần 2 bón phân NPK Phú Mỹ 20-20-15+TE Cây ăn quả.• Bón sau khi cắt tỉa: bón sau khi cắt tỉa từ 1 - 2 ngày.• Bón phục hồi sau thu hoạch: bón sau khi thu hoạch 1 - 2 ngày.• Sử dụng thìa/ muỗng có vạch định mức 5 - 10 gram để đong lượng phân bón.• Bón phân vào sáng sớm hoặc chiều mát.• Phân bón tăng hay giảm thùy theo thể tích đất trong chậu hoặc theo tình trạng sinh trưởng của cây trồng.Cách bón phân• Bón trực tiếp xa gốc cây (quanh tán cây) sau đó tưới nước.• Hoặc pha loãng theo tỷ lệ 5gram phân bón với 2 lít nước sau đó tưới đều quanh gốc, tránh tưới lên lá.Sử dụng cho cây trồng khác• Cây lương thực: lúa, ngô, khoai lang, khoai tây, sắn (khoai mì)...Bón lót: 100 - 400 kg/ ha.Bón thúc: 100 - 500 kg/ ha/ vụ.• Cây công nghiệp: cà phê, cao su, tiêu, điều, mía, chè, lạc (đậu phộng), đậu tương, đạu xanh...Bón lót: 100 - 1.000 kg/ ha.Bón thúc: 100 - 1.200 kg/ ha/ vụ.• Cây ăn quả (trái): cam, chanh, chanh dây, quýt, bưởi, xoài, nhãn, vải, táo, chôm chôm, sầu riêng, ổi, bơ, na, dứa, chuối...Bón lót: 100 - 1.000 kg/ ha.Bón thúc: 100 - 1.200 kg/ ha/ vụ.• Cây rau, màu: rau cải, cải bắp, su hào, cà chua, dưa hấu, dưa leo, tỏi, ớt, xà lách...Bón lót: 50 - 400 kg/ ha.Bón thúc: 50 - 500 kg/ ha/ vụ.Thông tin cảnh báo• Không nguy hiểm khi tiếp xúc, gây kích ứng nhẹ đối với mắt.• Tránh xa tầm tay trẻ em.Hướng dẫn bảo quản• Bảo quản kín trong túi và để nơi khô ráo, thoáng mát.• Tránh ánh nắng trực tiếp.Nông Nghiệp Phố - chuỗi cửa hàng chuyên cung cấp phân bón chất lượng, uy tín và hàng đầu trên cả nước.➤ Website: https://nongnghieppho.vn/➤ Hotline: 0865 399 086","36,000","['https://product.hstatic.net/1000269461/product/20-5-5-phu-my_e4feb105e5fd46a6981de97f9d7ec8d0_grande.jpg', 'https://product.hstatic.net/1000269461/product/20-5-5-phu-my-1_0eed68ef9e9149d28d3884db76f81960_grande.jpg', 'https://product.hstatic.net/1000269461/product/20-5-5-phu-my-2_5511d00ae5d14e9996f3a90e770fb170_grande.jpg']"
https://nongnghieppho.vn/products/phan-dap-song-gianh-18-46-kich-re-phan-hoa-mam-hoa-goi-50-gram,"Phân DAP SÔNG GIANH 18-46 kích rễ, phân hóa mầm hoa - Gói 50 gram","PHÂN DAP SÔNG GIANH 18-46 KÍCH RỄ, PHÂN HÓA MẦM HOA - GÓI 50GRAMMô tả: Phân DAP Sông Gianh 18-46 là sản phẩm hỗ trợ phát triển rễ mạnh, phân hóa mầm hoa và giúp cây trồng phát triển khỏe mạnh. Với hàm lượng đạm và lân cao, sản phẩm thúc đẩy lá xanh dày, thân cây mập, tăng cường khả năng ra hoa và đẻ nhánh nhanh chóng. Xuất xứ: Công ty Cổ phần Tổng Công Ty Sông Gianh Quy cách đóng gói: Gói 50gramThành phần, hàm lượng dinh dưỡng: Hàm lượng đạm tổng số (N): 18%Lân hữu hiệu (P2O5hh): 46%Độ ẩm: 2.5%Hàm lượng Cadimi ≤ 12 ppmCông dụng: Khỏe cây - Chắc cành.Bật lá mạnh - Lá dày xanh.Mập cây - Nở bụi.Phân hóa mầm hoa - Xử lý ra hoa.Hạn chế vàng lá.Ra rễ cực mạnh - Đẻ nhánh cực nhanh.Lượng sử dụng:Pha 20-30 gam với 18-25 lít nước sử dụng cho cây non và vườn ươm.Pha 50g (1 gói) với 18-25 lít nước sử dụng trong thời kỳ kiến thiết cơ bản và sau khi thu hoạch của cây trồng.Cách sử dụng:Phun hoặc tưới đều dung dịch lên lá, thân, cành và xung quanh gốc cây.Sử dụng vào sáng sớm hoặc chiều mát, khi trời không có gió và không mưa. Thực hiện định kỳ mỗi 7 - 10 ngày một lần.Có thể pha chế chung với các loại thuốc bảo vệ thực vật không chứa tính kiềm.Cảnh báo an toàn: Bảo quản nơi khô ráo, thoáng mát. Không gây nguy hiểm khi tiếp xúc trực tiếp. Rửa tay sạch sẽ sau khi sử dụng. Hạn sản dụng: 24 thángNông Nghiệp Phố – Hệ thống cung cấp chế phẩm sinh học và phân bón chất lượng, uy tín hàng đầu.➤ Website: https://nongnghieppho.vn/➤ Hotline: 0865 399 086","13,000","['https://product.hstatic.net/1000269461/product/dap-song-gianh_18-46_3_f347ee5c0e6b42b29ea0a08d9c93be53_grande.png', 'https://product.hstatic.net/1000269461/product/dap-song-gianh_18-46_3__1__f28c7d47907a401881004ca6bc20156f_grande.png']"
https://nongnghieppho.vn/products/gia-the-don-cong-trong-lan-da-qua-xu-ly-hn,Giá thể dớn cọng trồng lan đã qua xử lý - Túi 5dm3 (HN),"GIÁ THỂ DỚN CỌNG TRỒNG LAN ĐÃ QUA XỬ LÝ  Mô tả sản phẩm: Giá thể dớn cọng trồng lan đã qua xử lý được sử dụng để làm giá thể trồng hoa lan cực kì hiệu quả. Có thể kết hợp dớn cọng với một số giá thể khác như: vỏ thông, rêu rừng, dớn sợi, dớn khúc,... để trồng nhiều loại phong lan như: Lan Hài, Denro, Monkara, phi điệp hoặc giai đoạn cây con ban đầu.Xuất xứ: Công ty Thiện Xanh. Quy cách: Túi 5dm3 (khoảng 200 - 300 gram).Đặc điểm của dớn cọng đã qua xử lý• Dễ thoát nước, trồng lan bằng dớn cọng giúp trọng lượng chậu lan nhẹ hơn so với than, sạch, không mục rữa, ít đọng muối, sử dụng trong thời gian lâu dài.• Dớn trồng lan rất nhiều rễ, mềm mại, đan xen nhau nhưng không quá chặt. Dớn trồng lan có đặc tính giữ ẩm cao, thoáng rễ nên cây lan rất thích nghi và bộ rễ bám rất chặt vào dớn, bộ rễ của cây lan phát triển rất nhanh. Vì vậy, người trồng lan sử dụng dớn làm giá thể, vừa là chất trồng rất tiện lợi mà ít bị nấm mốc.Ưu điểm của dớn cọng đã qua xử lý• Là loại giá thể rất nhẹ rất hợp để trồng vào loại trên chậu.• Trồng cây nên trộn thêm 1 số loại vào chất trồng sẽ có nhiều chất bổ sung cho cây.• Dớn cọng có loại đã qua xử lí là loại giá thể sạch nên sẽ có ít nấm bệnh và vi khuẩn.• Loại này có lỗ rỗng ở giữa nhỏ để giữ ẩm làm mát cho bộ rễ.• Loại này trồng được bền rất thông thoáng giá thể làm cho cây phát triển rất tốt.Hướng dẫn sử dụng dớn cọng đã qua xử lý• Dớn Cọng đã được xử lý và trung hòa độ pH, chỉ cần ngâm với nước khoảng 30 phút cho Dớn Cọng ngấm nước là sử dụng bình thường.• Có thể kết hợp với Dớn Cọng với một số giá thể khác như: vỏ thông, rêu rừng, dớn sợi, dớn khúc,... để trồng nhiều loại phong lan.Nông Nghiệp Phố - chuỗi cửa hàng chuyên cung cấp vật tư trồng lan, rau và hoa kiểng tại nhà với hơn 1000+ sản phẩm. ➤ Website: https://nongnghieppho.vn/➤ Hotline: 0865 399 086","23,000","['https://product.hstatic.net/1000269461/product/249_de2fee4c366749fea6b6afad0c45f92c_grande.png', 'https://product.hstatic.net/1000269461/product/233_dc100ab9cafe4aaaabc4e679221353a2_grande.png', 'https://product.hstatic.net/1000269461/product/234_2953ed8be04547659a4ecf7ebc2c9b0c_grande.png']"
