url,name,description,price_vnd,image_urls
https://nongnghieppho.vn/products/combo-phuc-hoi-mai-o-tp-hcm,"Combo chăm sóc mai sau Tết – Phục hồi toàn diện, tăng sức đề kháng","Combo chăm sóc mai sau Tết – Phục hồi toàn diện, tăng sức đề khángMô tả sản phẩm: Sau Tết chính là thời điểm cây mai trở nên suy yếu nhất, đất không còn tơi xốp và dinh dưỡng trong đất cũng không còn dồi dào. Vì vậy, việc phục hồi cây mai sau Tết là việc cần phải thực hiện ngay lập tức để mai đủ sức khỏe và phát triển mạnh mẽ.Bộ sản phẩm gồm- 1 Đất trồng mai SFARM- 20dm3- 1 Phân Bón Lá Kích Ra Rễ Cực Mạnh N3M- 100g- 1 Bánh dầu đậu phộng LAVAMIX dạng bột đã qua xử lý - Gói 1kg- 1 Phân bón lá cao cấp Đầu Trâu MK 501 (30-15-10)- 1 Phân bón vi lượng CAM Bi Nhật Bản - Gói 40g Chức năng - công dụng• Đất trồng mai Sfarm: được phối trộn từ các nguồn nguyên liệu hữu cơ đảm bảo cân bằng về mặt cấu trúc, phù hợp cho quá trình phục hồi và phát triển của cây mai.• Kích rễ N3M: thúc đẩy nhanh quá trình hồi phục và tăng trưởng, kích thích mai mau chóng ra rễ tơ và hấp thụ chất dinh dưỡng một cách hiệu quả.• Bánh dầu đậu phộng: đây là loại phân hữu cơ có hàm lượng đạm rất cao, phù hợp cho mai sau khi cắt tỉa và thay đất, giúp mai nhanh chóng hồi sức và phát triển thân cành.• Phân bón lá cao cấp Đầu Trâu MK 501: cung cấp dinh dưỡng nhanh chóng qua lá, giúp cây mai phục hồi sau thời kỳ ra hoa hoặc sau các giai đoạn bị suy kiệt.• Phân bón vi lượng CAM Bi Nhật Bản: giúp phục hồi cây mai sau Tết bằng cách bổ sung vi lượng cần thiết, kích thích lá non và chồi mới phát triển mạnh mẽ. Sản phẩm tăng sức đề kháng, giúp cây phục hồi nhanh chóng và chuẩn bị cho chu kỳ sinh trưởng tiếp theo.Hướng dẫn sử dụngBước 1: Chuẩn bị đất trồng mai SFARM• Sử dụng 1 bao đất trồng mai SFARM 20dm³ để thay hoặc bổ sung đất cho cây mai.• Nếu thay đất toàn bộ, tiến hành tỉa rễ cây, giữ lại các rễ khỏe mạnh và loại bỏ rễ hư thối.• Cho đất mới vào chậu, đảm bảo chậu thoát nước tốt, lấp đất cách miệng chậu khoảng 2-3cm.Bước 2: Chuyển đất mới vào chậu hoặc hố trồng• Tiến hành cho đất đã trộn ở bước 1 vào trong chậu hoặc hố trồng. Tách cây mai ra, tránh làm ảnh hưởng bộ rễ càng nhiều càng tốt để tránh làm cây suy yếu. Nên giữ 1 ít đất cũ ở phần rễ của cây mai trước khi chuyển sang đất mới.Bước 3: Tiến hành tưới kích thích ra rễ mới cho cây mai• Sau khi đã chuyển chậu cho mai xong. Bạn tiến hành phun hoặc tưới kích thích ra rễ N3M cho cây mai để rễ tơ của cây mai phát triển mạnh hơn. • Tiến hành pha loãng Kích thích ra rễ N3M với hàm lượng 20 gram cho 10 lít nước sạch. Tưới vào gốc cây mai thật đều và đẫm. Tưới với chu kì 7 ngày 1 lần trong tháng đầu tiên. • Sau 15-20 ngày khi cây bắt đầu nảy đọt và mầm thì tiến hành tưới Phân bánh dầu, pha với tỷ lệ 20-25 ml cho 10 lít nước. Có thể phun lên lá hoặc tưới gốc 7 – 10 ngày, rất hiệu quả trong giai đoạn dưỡng, phát triển thân lá, hình thành chồi con.• Liều lượng bón phân bánh dầu có hướng dẫn chi tiết trên bao bì.Bước 4: Tiến hành chăm sóc maiSử dụng phân bón vi lượng CAM Bi Nhật Bản: Pha 5-10g phân với 10 lít nước sạch, tưới đều quanh gốc hoặc phun lên lá để bổ sung vi lượng cần thiết, giúp cây phục hồi và phát triển mạnh mẽ.Sử dụng phân bón lá cao cấp Đầu Trâu MK 501 (30-15-10): Pha 1-2g phân với 1 lít nước sạch, phun đều lên toàn bộ lá cây vào buổi sáng hoặc chiều mát để kích thích sự phát triển của lá và chồi non.Thực hiện định kỳ: Kết hợp sử dụng hai loại phân trên luân phiên, mỗi 10-15 ngày/lần, để cung cấp đầy đủ dinh dưỡng, giúp cây mai phục hồi nhanh chóng và phát triển khỏe mạnh.Lưu ý• Tưới nước đều đặn, giữ độ ẩm vừa phải, tránh làm úng đất.• Tỉa bớt lá già và các cành hư để cây tập trung dinh dưỡng nuôi chồi non.• Đặt cây ở nơi thoáng mát, nhiều ánh sáng tự nhiên để cây phát triển tốt hơn.Nông Nghiệp Phố - chuỗi cửa hàng chuyên cung cấp dụng cụ làm vườn chất lượng, uy tín với hơn 1000+ sản phẩm trên cả nước.➤ Website: https://nongnghieppho.vn/➤ Hotline: 0865 399 086","168,000",['https://product.hstatic.net/1000269461/product/combo-phuc-hoi-mai-sau-tet-1_78d932d16932442b9066c45d54565fb8_grande.png']
https://nongnghieppho.vn/products/combo-kich-hoa-mai-no-o-tp-hcm,Combo kích hoa mai nở trước tết ở TP. HCM,"COMBO ĐƠN KÍCH HOA MAI NỞ Mô tả sản phẩm Bộ sản phẩm đơn kích hoa mai nở được thiết kế đặc biệt nhằm mục đích hỗ trợ cây mai phát triển mạnh mẽ và nở hoa đúng dịp Tết. Sản phẩm cung cấp các dưỡng chất và giải pháp cần thiết để kích thích cây mai ra hoa đều, bông to, màu sắc rực rỡ, mang lại vẻ đẹp hoàn hảo cho những ngày đầu năm mới.Bộ sản phẩm gồm- 1 Phân bón đầu trâu BĐ-MK 20-20-15 chuyên cho rau màu - hoa kiểng- 1 Phân bón lá đậm đặc cao cấp VITAMIN B1 GROWMOREChức năng- Công dụngPhân bón Đầu Trâu BĐ-MK 20-20-15 (chuyên cho rau màu, hoa kiểng): Cung cấp đầy đủ các dưỡng chất cần thiết (NPK) với tỷ lệ cân đối 20-20-15, phù hợp cho giai đoạn nuôi nụ và phát triển hoa. Hỗ trợ cây mai hình thành nụ nhanh, tăng kích thước nụ, và giúp nụ khỏe mạnh hơn. Bổ sung các chất dinh dưỡng thiết yếu giúp cây không bị suy kiệt trong quá trình nuôi hoa. Phân bón lá đậm đặc cao cấp VITAMIN B1 GROWMORE: Bổ sung Vitamin B1, axit amin, và các vi lượng giúp cây phục hồi nhanh chóng, tăng cường sức sống và khả năng phát triển. Giúp cây chịu được các điều kiện thời tiết bất lợi và căng thẳng trong quá trình phát triển hoa.Hướng dẫn sử dụngSản phẩm phân bón Đầu Trâu BĐ-MK 20-20-15Giai đoạn trước khi cây ra nụ (khoảng 1 tháng trước Tết)Pha 1 muỗng canh (10g) phân bón với 4-5 lít nước.Tưới đều lên gốc cây hoặc phun nhẹ lên tán lá.Tưới định kỳ 7-10 ngày/lần, giúp cung cấp dinh dưỡng cho cây phát triển nụ đều và khỏe.Giai đoạn nuôi nụ và kích hoaTăng tần suất tưới lên 5-7 ngày/lần, giúp nụ lớn nhanh, hoa phát triển tốt hơn.Lưu ý: Không bón quá liều để tránh làm cây bị ngộ độc dinh dưỡng. Sản phẩm Vitamin B1 GrowmoreGiai đoạn phục hồi và phát triển rễPha 1-2ml (khoảng 1/2 muỗng cà phê) với 1 lít nước.Phun đều lên toàn bộ lá và thân cây, hoặc tưới trực tiếp vào gốc.Sử dụng 7-10 ngày/lần để kích thích rễ phát triển mạnh và tăng sức đề kháng cho cây.Giai đoạn thúc hoaPha với nồng độ tương tự (1-2ml/lít nước).Phun đều lên lá và nụ hoa. Sử dụng định kỳ 5-7 ngày/lần để hỗ trợ nụ bung hoa đúng thời điểm.","64,000",['https://product.hstatic.net/1000269461/product/combo_don_kich_hoa_mai_no_a6f61c6c3a494186a85e23bfb92503e8_grande.png']
https://nongnghieppho.vn/products/hat-giong-rau-diep-thom-xa-lach-la-nhon-rado-358-goi-10gr,Hạt giống Rau diếp thơm (Xà lách lá nhọn) RADO 358 - Gói 10 gram,"Hạt giống Rau diếp thơm ( Xà lách lá nhọn ) RADO 358 - gói 10gr Mô tả sản phẩmRau diếp thơm là loại cây thuộc họ Xà lách. Diếp thơm thuộc loại rau ngắn ngày và được trồng phổ biến ở nước ta. Cây thân thảo, dạng hình trụ và phân nhánh ở ngọn. Các lá mọc so le từ trụ, thân lá mềm, phiến lá dài và to nhưng không cuộn. Đồng thời lá có hình mác mỏng và xuất hiện răng cưa nhẹ phía hai mép lá. Càng lên cao đầu lá thon nhỏ dần.  Xuất xứ: Công ty TNHH MTV hạt giống Rạng Đông.Quy cách đóng gói: Gói 10gram.Một số thông tin • Tỷ lệ nảy mầm: >85%• Ðộ sạch: >99%• Độ ẩm: <10%  Công dụng của rau diếp thơmRau diếp thơm chứa nhiều Vitamin, Canxi, chất xơ và các khoáng chất khác rất tốt cho cơ thể. Dưới đây là những lợi ích của rau diếp thơm đối với sức khỏe• Là một trong những nguồn thực phẩm rất giàu vitamin, đặc biệt là vitamin A. Không những vậy, lượng lớn beta-caroten trong rau diếp thơm cũng được chuyển hóa thành vitamin A khi tiêu thụ. Lượng vitamin A dồi dào này sẽ thúc đẩy các màng nhầy trong cơ thể. Nhờ vậy mà ăn rau diếp sẽ giúp cải thiện thị lực cho đôi mắt, duy trì làn da khỏe mạnh hơn • Không chỉ giàu vitamin, rau diếp thơm còn có chứa một nguồn khoáng chất phong phú như canxi, magiê và kali, sắt, đồng, mangan… Các khoáng chất này giúp kích thích quá trình trao đổi chất trong cơ thể. Kali giúp điều chỉnh sự cân bằng của các chất dịch cơ thể, từ đó ổn định huyết áp và cải thiện sức khỏe tim mạch. Độ chắc khỏe của răng và xương cũng được tặng cường nhờ có lượng lớn canxi trong rau diếp. Sắt và đồng là yếu tố quan trọng trong quá trình sản sinh các tế bào hồng cầu trong cơ thể. Vì vậy rau diếp thơm là một loại thực phẩm rất có lợi cho sức khỏe của bạn.• Trong rau diếp tươi có chứa lượng vitamin C và folate dồi dào. Folate có tác dụng hiệu quả trong việc duy trì sức khỏe của thai nhi. Cụ thể, trong quá trình mang thai, Folate giúp làm giảm các nguy cơ biến chứng như dị tật bẩm sinh... Cũng nhờ có lượng folate mà rau diếp cũng giúp cải thiện sức khỏe sinh sản ở cả phụ nữ và nam giới. Bên cạnh đó, lượng vitamin C dồi dào có trong rau diếp giúp chống lại bệnh nhiễm trùng và cải thiện hệ thống miễn dịch. Hướng dẫn sử dụngChuẩn bị giống• Ngâm hạt giống trong nước ấm (2 sôi : 3 lạnh) trong 2 – 5 giờ. Tiếp đem hạt giống đã ngâm đi rửa sạch rồi ủ khăn ấm đến khi hạt có giấu hiệu nảy mầm thì đem đi gieo ngay.• Giá thể ươm hạt bạn có thể sử dụng giá thể ươm hạt Sfarm, giá thể mụn dừa, giá thể trấu hun… Sau đó bạn cho giá thể vào các khay nhựa, khay xốp ươm hạt chuyên dụng, đặt hạt vào giữa các lỗ rồi phủ nhẹ lại bằng giá thể ươm.• Thường xuyên kiểm tra để đảm bảo đất vẫn ẩm, tuy nhiên cẩn thận không tưới quá nhiều nước gây thối mốc hạt. Sau khoảng 10 – 14 ngày hạt giống rau diếp thơm bắt đầu nảy mầm.• Khi cây con cao 7 – 10cm, có 2-3 lá thật thì đem trồng ra ngoài đất.Điều kiện trồng• Rau diếp thơm có thể gieo trồng quanh năm, cây thích hợp trồng nhất khi khí hậu mát mẻ nên bạn hãy trồng vào mùa đông, mùa xuân, mùa thu để đạt năng suất cao. • Khi trồng rau diếp thơm bạn cần đảm bảo độ ẩm gieo trồng vừa phải khoảng 70 - 80%, nhiệt độ gieo trồng tốt nhất là từ 15 - 25 độ C • Đất: Không kén đất, có thể trồng bất kể chân đất nào miễn thoát nước tốt là được.Lưu ý• Sản phẩm có giá trị khi bao bì còn nguyên vẹn.• Bảo quản nơi khô ráo, thoáng mát, tránh côn trùng (tránh nơi mặt trời chiếu trực tiếp vào bao hạt giống hoặc nơi có nguồn nóng) để duy trì sức sống hạt giống được lâu dài.Sản phẩm tham khảo: Đất sạch hữu cơ Sfarm chuyên dùng cho rau ăn láNông Nghiệp Phố - chuỗi cửa hàng chuyên cung cấp hạt giống uy tín với hơn 1000+ loại giống.➤ Website: https://nongnghieppho.vn/➤ Hotline: 0865 399 086","9,000","['https://product.hstatic.net/1000269461/product/hat-giong-rau-diep-thom_42cb7c1853914357af56a8f48d87fd28_grande.jpg', 'https://product.hstatic.net/1000269461/product/rau_diep_rang_dong_d0937f2100fc4d828bfef46b3eb37a50_grande.jpg', 'https://product.hstatic.net/1000269461/product/giong-xa-lach-la-nhon-rau-diep-thom-rado-358-1-600x503_4ebf44716ac14ab2ae852fb757a99ee1_grande.jpg']"
https://nongnghieppho.vn/products/don-bang-trong-lan-1,Dớn bảng trồng lan,"Dớn bảng trồng lan  Mô tả sản phẩm: Sản phẩm dớn bảng chuyên dùng làm giá thể cho lan. Dớn được làm từ thân và rễ của cây dương xỉ. Gía thể dớn bảng chứa nhiều lỗ hở, thoáng khí nên rất thích hợp cho những loại lan rễ nhỏ có thể xuyên qua như thân thòng,đa thân.Kích thước: (Dài x rộng)+ Dớn loại 60x20cm+ Dớn loại 30x20cmƯu điểm của dớn bảng: Giá thể nhẹ và dễ trồng cho các chậu để treo, không đóng rêu, rất lâu mục, ít bị nhiễm vi sinh vật gây bệnh. Có nhiều lỗ nên thoáng khí, tạo độ thông thoáng cho bộ rễ.Lưu ý khi dùng dớn bảng: Bộ dớn đóng dạng bảng dài , cồng kềnh nên cần chặt, dinh dưỡng không nhiều, cần bổ sung thêm phân bón như phân trùn quế hay phân bón cho lanCách xử lý dớn bảng trồng lan- Ngâm dớn trong nước vôi (100 gam vôi pha 10 lít nước) từ 30 phút đến 3 ngày tùy điều kiện cho phép. Mục đích để trung hòa acid trong dớn, diệt trừ nấm khuẩn, các loại côn trùng gây hại như rết, cuốn chiếu, sên và ốc sên, dế, gián, mối, kiến… Nếu ngâm được lâu thì còn diệt được cả mầm cỏ dại.- Nếu bạn thực sự có điều kiện thì có thể đem dớn đi luộc trong nước vôi, hiệu quả sẽ cao hơn rất rất nhiều.- Sau khi ngâm vôi xong, bạn phải rửa lại thật sạch với nước lã và để ráo rồi ghép lan lên.Cách sử dụng: Dùng làm giá thể cho lan ưa thoáng gốc, thoát nước tốt, tránh bị úng. Chặt ra khúc dài theo kích thước chậu của bạn. Trộn thêm phân bón cho cây. Thường dùng cho lan rễ chùm. Xem thêm bài viết Phân bón vật tư cho lanDùng viên đất nung cho lan","49,000","['https://product.hstatic.net/1000269461/product/4_c9b44d12d0844c1bbf3b265f0512578c_grande.jpg', 'https://product.hstatic.net/1000269461/product/5_54386b1079054759a2b042f5026d0edd_grande.jpg', 'https://product.hstatic.net/1000269461/product/6_37a5d147e8bb4b19bf7ab923655424ad_grande.jpg']"
https://nongnghieppho.vn/products/phan-vi-luong-song-gianh-k5-chuyen-dung-cho-hoa-va-cay-canh-chai-500ml,Phân vi lượng SÔNG GIANH K5 chuyên dùng cho hoa và cây cảnh - Chai 500ml,"PHÂN VI LƯỢNG SÔNG GIANH K5 CHUYÊN DÙNG CHO HOA VÀ CÂY CẢNH - CHAI 500MLMô tả: Phân vi lượng Sông Gianh k5 giải pháp tối ưu giúp hoa và cây cảnh luôn khỏe mạnh và tươi đẹp, được sản xuất bằng nguyên liệu ngoại nhập.  Với thành phần vi lượng đa dạng cùng chất kích thích quang hợp, sản phẩm hỗ trợ bộ rễ phát triển mạnh, giúp cây hấp thu dinh dưỡng tốt hơn, tăng sức đề kháng và giữ cho hoa lá tươi lâu, màu sắc rực rỡ.Xuất xứ:Công ty Cổ phần Tổng Công Ty Sông Gianh Quy cách đóng gói: Chai 500mlThành phầnN: 25,27 g/l; P2O5: 17,75 g/l; K2O: 49,40 g/l; Ca: 45,5 PPm; Mg: 12,2 PPm; S: 19,5PPm; Fe: 379 PPm; Mn: 180 PPm; Cu: 62,5PPm; Zn: 107 PPm; B: 160 PPm; Mo: 47,5 PPm.Chất kích thích quang hợp, hợp chất Humic.Công dụng: Cung cấp đầy đủ dưỡng chất, giúp cây phát triển cân đối, đâm chồi mạnh, đẻ nhánh khỏe, thân cành và rễ sum suê, dẻo dai, dễ uốn tỉa.Kích thích ra rễ mạnh, tăng khả năng hấp thụ nước và dinh dưỡng, thúc đẩy thân lá phát triển cân đối, ra nhiều nhánh, hoa nở đều.Giúp thân cây cứng cáp, cành mập, hoa rực rỡ, tươi lâu, bền màu, giữ mùi hương đặc trưng.Tăng cường diệp lục, giúp lá xanh lâu, hạn chế rụng hoa.Hướng dẫn sử dụng: Pha 20-30 ml dung dịch trong 16 - 18 lít nước sạch, tưới đều quanh gốc hoặc phun ướt đều trên mặt lá, hoa và cây cảnh sau khi cắt tỉa, tạo tán. Sử dụng từ lúc cây 4-5 lá đến khi ra hoa và sau khi thu hoạch (đối với những loại hoa thu hoạch nhiều lần). Mỗi lần sử dụng cách nhau từ 7-10 ngày. Lưu ý: Lắc đều trước khi dùngSử dụng sáng sớm hoặc chiều mát, lúc trời lặng gió và không mưaCó thể pha chung với cái loại thuốc BVTV không có tính kiềmNgưng sử dụng trước khi thu hoặc 7-10 ngày. Hạn sử dụng và bảo quản: Hạn sử dụng: 24 tháng kể từ ngày sản xuấtBảo quản nơi khô ráo, thoáng mát, tránh ánh nắng trực tiếp và để xa tầm tay trẻ emNông Nghiệp Phố – Hệ thống cung cấp chế phẩm sinh học và phân bón chất lượng, uy tín hàng đầu.➤ Website: https://nongnghieppho.vn/➤ Hotline: 0865 399 086","45,000","['https://product.hstatic.net/1000269461/product/vi-luong-k5_1_69cd27d0d04a4f85816c0b74caa1157b_grande.jpg', 'https://product.hstatic.net/1000269461/product/vi-luong-k5_2_5b64665cfb8641199408c46d8a4a64db_grande.jpg']"
https://nongnghieppho.vn/products/chat-kich-thich-sinh-truong-gibberellic-acid-99-ga3-goi-5-gram,"Chất kích thích sinh trưởng Gibberellic Acid 100% (GA3) - Giúp hoa trổ đều, tăng tỷ lệ đậu trái - Gói 5 gram","CHẤT KÍCH THÍCH SINH TRƯỞNGGIBBERELLIC ACID 100% (GA3)Mô tả sản phẩmChất kích thích sinh trưởng Gibberellic Acid 100% (GA3) có chứa hormone kích thích sinh trưởng Gibberelin có khả năng kích thích sinh trưởng, giúp cây phát triển mạnh và nâng cao năng suất cây trồng.Quy cách: Gói 5gram.Thành phần: • Gibberellic acid...50g/kg • Phụ gia đặc biệt: 950g/kgChức năngDùng phun lên cây trồng làm tăng trưởng các tế bào theo chiều dọc của cây và lá:• Kích thích hoa trổ đều, gia tăng tỉ lệ đậu trái. Giảm rụng trái non và tăng phẩm chất trái. Kéo dài thời gian thu hoạch.• Gibberellic Acid 100% GA3 50TB giúp phá vỡ miên trạng khi ngâm ủ hạt giống. Giúp hạt nảy mầm nhanh, ngoi nước tốt.• Giúp cây đẻ nhánh mạnh và tập trung. Tăng cường sinh trưởng, trổ bông đồng loạt.• Giúp chè xanh tăng chu kỳ thu hoạch lá, tăng năng suất và hương vị. • Giúp Thanh Long lớn, phì, bóng, đẹp, lõi đặc không xốp rỗng, tai xanh dài. Đặc biệt giúp Thanh Long chống lại hiện tượng thường gặp như: lem trái, ghẻ trái, rạn nứt ngoài vỏ trái, giữ được màu sắc tươi đẹp của trái lâu hơn sau khi cắt. • Giúp Lúa trổ đồng loạt, chống rụng hạt, làm to hạt, mẩy hạt, hạt không bị gãy khi xay chà. Cách dùngChất kích thích sinh trưởng cây trồng GA3 thích hợp cho tất cả các loại cây trồng như cây ăn trái, rau màu (ăn lá, ăn hoa, ăn củ), hoa kiểng, bonsai, cây cảnh, ...• Phun: pha 1 viên cho 16 - 32 lít nước tùy vào đối tượng cây trồng và dụng cụ phun.• Tùy theo cây lớn - nhỏ mà điều chỉnh lượng nước cho phù hợp.Lưu ý• Không phun khi trời nắng gắt hoặc có mưa, cần tưới nhiều nước và bổ sung chất dinh dưỡng, vi lượng đầy đủ.• Phun thật đều và ướt toàn diện hai mặt lá. Thường chỉ nên sử dụng 1 đến 2 lần cho 1 kỳ thu hoạch.• Không nên phun sớm hơn 3 tuần lễ sau khi gieo cấy hoặc có sản phẩm khác chứa GA3 đã được dùng để xử lí hạt giống.• Có thể hỗn hợp chung với các loại thuốc bảo vệ thực vật khác. • Ngưng phun 3 ngày trước khi thu hoạch. Hướng dẫn an toàn • Mặc quần áo bảo hộ khi đang pha hoặc phun thuốc. • Không phun thuốc ngược chiều gió. Không ăn uống, hút thuốc khi đang pha hoặc phun thuốc. • Tắm rửa sạch sẽ và thay quần áo ngay ssu khi phun hoàn tất. • Không súc rửa dụng cụ phun xịt nơi ao hồ, nguồn nước sinh hoạt. Hướng dẫn bảo quản• Bảo quản nơi khô ráo, thoáng mát.• Tránh xa tầm tay trẻ em.Nông Nghiệp Phố - chuỗi cửa hàng chuyên cung cấp phân bón vô cơ chất lượng, uy tín và hàng đầu trên cả nước.➤ Website: https://nongnghieppho.vn/➤ Hotline: 0865 399 086","8,000","['https://product.hstatic.net/1000269461/product/gibberellic_acid_100___ga3__adb922a633fd422091c1f02ca9cfa470_grande.jpg', 'https://product.hstatic.net/1000269461/product/anh_san_pham_moi___1__dd128ac522c34ea09d32b357141ed9bf_grande.png']"
https://nongnghieppho.vn/products/chat-kich-thich-sinh-truong-comcat-150wp-goi-3-8gr,"Chất kích thích nảy mầm, sinh trưởng hạt giống - Comcat 150WP - Gói 3.8 gram","CHẤT KÍCH THÍCH SINH TRƯỞNG COMCAT 150WPMô tả sản phẩmSản phẩm chất kích thích sinh trưởng COMCAT 150WP được chiết xuất từ cây Lychnis viscaria với hàm lượng 15%. Sản phẩm có chức năng kích thích sinh trưởng phong lan, giúp hạt giống nảy mầm và sinh trưởng mạnh như: Lúa, ngô,.. bên cạnh đó ức chế được bệnh vàng lùn, lùn xoắn lá... trên lúa.Xuất xứ: Công ty Hóa Nông Lúa Vàng.Quy cách: Gói 3.8 gram. Thành phầnLychnis viscaria: 15 w/w.Chức năng• Kích thích sự nảy mầm và sinh trưởng của hạt giống như: lúa, ngô,...• Kích thích sinh trưởng cho phong lan, giúp phong lan tươi và xanh mượt hơn.• Tiêm vắc xin, tăng đề kháng cây trồng.• Ức chế bệnh vàng lùn, lùn xoắn lá.• Phun mọi giai đoạn, kích thích mọi bộ phận.• Phục hồi sinh trưởng.• Có thể pha với thuốc sâu, rầy, bệnh, cỏ.Cách dùng• Pha nồng độ 0.04% thuốc comcat, phun đều lên phong lan. Phun trong giai đoạn cây con và giai đoạn trước ra hoa.• Hoặc pha 1 gói cho bình 18-20 lít.Hướng dẫn bảo quản• Bảo quản nơi khô ráo, thoáng mát.• Tránh xa tầm tay trẻ em.Nông Nghiệp Phố - chuỗi cửa hàng chuyên cung cấp phân bón vô cơ chất lượng, uy tín và hàng đầu trên cả nước.➤ Website: https://nongnghieppho.vn/➤ Hotline: 0865 399 086","11,500",['https://product.hstatic.net/1000269461/product/tui_dao_don_-_tui_guc_nga__1__d09bbf8fb405458bb1ef378a71150695_grande.png']
